Company Name,Service Type,Website,Referral Commission,Contact Method,Notes,Date Added
BBSI,PEO/Payroll/HR,https://www.bbsi.com,Commission-based,Partner signup,P&C brokers and CPA partners - Lifetime commissions,2025-02-15
HRDelivered,PEO/HR Services,https://hrdelivered.com,Commission-based,Partner signup,Broker channel partnership program,2025-02-15
EESI PEO,PEO Services,https://www.eesipeo.com,Commission-based,Referral page,Professional Employer Organization referral program,2025-02-15
Amplify HR,HR/Payroll,https://www.amplifyhr.com,One-time referral bonus,Refer-us page,Referral commission structure for clients/partners,2025-02-15
Aspen HR,PEO Services,https://aspenhr.com,Commission-based,PEO referral partners,Trusted PEO partnership solutions,2025-02-15
Hybrid Payroll,Payroll Services,https://hybridpayroll.com,Commission-based,Partner signup,Payroll referral program - fast risk-free partnership,2025-02-15
Engage PEO,PEO/HR Outsourcing,https://www.engagepeo.com,Commission-based,Broker program,Leading PEO for SMBs across US,2025-02-15
PEO Benefit Partners,PEO/HR,https://www.peobenefitpartners.com,Lifetime recurring commission,Become a partner,Recurring revenue for lifetime of client,2025-02-15
ExtensisHR,PEO Services,https://extensishr.com,Commission-based,Broker partnership,Broker-centric business model,2025-02-15